Year,Month,Title,Total Authors,China Authors,Unknown Authors,Other Authors,Access Type
2026,3,Integration of Near-Proximal and Proximal Lidar Sensing for Fine-Resolution Forest Inventory,7,2,5,0,Open Access content
2026,3,"Review of NASA Earth Observations, Recent Science, and Practical Applications",2,0,2,0,Open Access content
2026,3,Remote Sensing’s Role in Assessing the Risks of Climate Extremes,1,0,1,0,Subscribed content
2026,3,Detecting Altimetric Changes in Arctic Landscapes Using Historical Aerial Imagery-Derived Digital El,3,0,3,0,Open Access content
2026,3,Urban Heat Island Studies Using Satellite Imagery Coupled with Field Measurements: A Case Study from,5,1,4,0,Open Access content
2026,2,An Efficient Multi-Scale Transformer Network with Fusion-Attention for Point Cloud-Semantic Segmenta,8,6,2,0,Subscribed content
2026,2,Graph Neural Network-Based Land Cover-Classification of Remote Sensing Images Using Multi-Scale and ,4,4,0,0,Subscribed content
2026,2,Probabilistic Uncertainty-Guided Salient Object Detection in Remote Sensing Images,6,6,0,0,Subscribed content
2026,2,Accuracy Evaluation of Airborne and Terrestrial Point Cloud Registration,1,0,1,0,Open Access content
2026,1,RSIDetNet: An Efficient Oriented Small Object Detection Model for Remote Sensing Images Based on Cro,7,6,1,0,Open Access content
2026,1,Comparison of Intertidal Terrain Extraction Methods Based on ICESat‐2 and Tidal Data,6,5,1,0,Open Access content
2026,1,Optimized 3D Building Mapping and Reconstruction via Cross-View Collaboration in Densely Built-Up Ar,7,7,0,0,Open Access content
2026,1,A Lightweight YOLO-Based Algorithm for Digital Target Recognition Integrating Positional Enhancement,4,4,0,0,Subscribed content
2025,12,A Novel Multi-level Feature Collaborative Matching Network for Optical and Synthetic Aperture Radar ,5,4,1,0,Subscribed content
2025,12,Joint Detection and Parameters Regression of Detailed Windows based on Facade Textures via an Adapti,8,7,1,0,Subscribed content
2025,12,Evaluating Three-Dimensional Elevation Program Lidar Consistency and Accuracy at Scale Using Cloud-N,3,0,3,0,Open Access content
2025,12,ETF-MNet:A Multi-Scale Fusion Network for Enhancing Target Features for Remote Sensing Images,6,6,0,0,Subscribed content
2025,12,Assessing the Accuracy of a 2021 Kansas‐Oklahoma Tallgrass Ecosystem Burn Area Map,6,0,5,1,Open Access content
2025,11,An Efficient Irregular Texture Nesting Method via Hybrid NFP-SADE with Adaptive Container Resizing,5,4,1,0,Open Access content
2025,11,Thermal Point Cloud Generation and Evaluation from Uncalibrated Unmanned Aerial Vehicle–Visible and ,7,6,1,0,Subscribed content
2025,11,Landsat-Derived Rainfed and Irrigated-Area Product for Conterminous United States for the Year 2020 ,11,1,10,0,Open Access content
2025,11,Novel Spatiotemporal ConvLSTM-Based Cellular Automata Model for Simulating Urban Expansion,4,4,0,0,Subscribed content
2025,10,Global Multi-Scale Fusion Self-Calibration Network for Remote Sensing Object Detection,8,8,0,0,Subscribed content
2025,10,MRTD-Based Effective Range Analysis of Airborne Infrared Imaging Systems for Ship Detection: Optimiz,9,8,1,0,Open Access content
2025,10,Convolutional Neural Networks for Land Use and Land Cover Multi-class Maps from Historical Aerial Ph,1,0,1,0,Open Access content
2025,10,Thirty Years of the U.S. National Land Cover Database: Impacts and Future Direction,10,1,7,2,Open Access content
2025,9,Crack Parameter Determination Based on Multiple-Window Matching Strategy and Crack Grid Geometry Ana,13,11,1,1,Subscribed content
2025,9,LFSA‐YOLOv7: A Novel Method for Ship Detection in Remote Sensing Images with Complex Backgrounds,7,7,0,0,Subscribed content
2025,9,Lightweight and Accurate Video Synthetic Aperture Radar Target Detection Network,4,4,0,0,Subscribed content
2025,8,Hierarchical Multi-Scale Cross Interaction Network for Enhanced Hyperspectral Image Classification,4,4,0,0,Subscribed content
2025,8,Efficient Coral Survey Using Aerial Remote Sensing and Multi-modal Segmentation for Large-Scale Ecol,6,3,3,0,Open Access content
2025,8,On the Transferability of Semantic Segmentation for Very-High-Resolution Remote Sensing Data of Mult,3,3,0,0,Open Access content
2025,7,Combined Use of Satellite Observations and the RIM for Assessing Recovery from Natural Disasters,6,5,1,0,Open Access content
2025,7,Analysis of Landslide Susceptibility of the Darjeeling District Using a Frequency Ratio Model and Ge,2,0,1,1,Subscribed content
2025,7,Leadership in COVID-19: Mitigation Strategies across Top 30 Gross Domestic Product Countries,2,0,2,0,Subscribed content
2025,7,Lyme Disease Risk Map and Prioritizing Areas for Vaccine Deployment,2,0,2,0,Subscribed content
2025,7,Enhancing Residential Building Identification in a Coastal Texas City: An Integrated Framework Lever,3,3,0,0,Subscribed content
2025,7,Spatiotemporal Continuous Shallow Water Bathymetry from a Kriged Kalman Filter,6,4,2,0,Open Access content
2025,6,Texture-Semantic Point: Registration for Point Clouds of Porcelain Relics,6,5,1,0,Subscribed content
2025,6,A High-Quality Underwater 3D Reconstruction Solution for Coral Reef Environments Leveraging Advanced,6,4,2,0,Open Access content
2025,6,Phase Center Extraction of Corner Reflector Points in Single-Look Complex Image,6,6,0,0,Subscribed content
2025,5,PROSAIL Modeling Coupled with Environmental Stress: Remote Sensing Retrieval of Multiple Dry Matters,9,8,1,0,Subscribed content
2025,5,Wave Period and Direction Inversion from Marine X-band Radar Images using Spatiotemporal Feature Joi,5,2,3,0,Subscribed content
2025,5,Improving Crop Classification by Integrating Phenology Using Random Forests: Assessing the Role of F,5,3,2,0,Open Access content
2025,4,Sat2building: Lod-2 Building Reconstruction from Satellite Imagery Using Spatial Embeddings,5,1,3,1,Open Access content
2025,4,The Aboveground Carbon Stock of Moso Bamboo Forests Is Significantly Reduced byPantana phyllostachys,9,8,1,0,Subscribed content
2025,4,Cost-Effective High-Definition Building Mapping: Box-Supervised Rooftop Delineation Using High- Reso,5,4,1,0,Subscribed content
2025,3,Accuracy Assessment of Dense Point Cloud Generated by Deep Learning and Semiglobal Matching,1,0,0,1,Subscribed content
2025,3,A Comparative Study of Deep Learning Methods for Automated Road Network Extraction from High-Spatial,8,7,1,0,Open Access content
2025,3,Real-time Vanishing Point Tracking in Manhattan World Using Improved BaySAC,4,4,0,0,Subscribed content
2025,2,Spatiotemporal Behavior of Active Forest Fires Using Time-Series MODIS C6 Data,2,0,2,0,Open Access content
2025,2,Artificial Neural Network Multi-layer Perceptron Models to Classify California's Crops using Harmoni,6,0,6,0,Open Access content
2025,2,Individual Tree Segmentation Using Deep Learning and Climbing Algorithm: A Method for Achieving High,4,4,0,0,Open Access content
2025,2,Lightweight Ship Object Detection Algorithm for Remote Sensing Images Based on Multi-scale Perceptio,4,3,1,0,Open Access content
2025,1,Landslide Evolution Assessment Based on Sequential InSAR Methods in the Kunming Transmission Line Co,8,7,1,0,Subscribed content
2025,1,Adaptive Orientation Object-Detection Method for Large-scale Remote Sensing Images Based on Multi-sc,4,3,1,0,Subscribed content
2025,1,RSODNet: Lightweight Remote Sensing Image Object Detection Combined with BCDNS Compression Algorithm,5,4,1,0,Subscribed content
2025,1,Monitoring and Predictive Analysis of Surface Deformation Using Combined SBAS-InSAR Technology and C,2,2,0,0,Subscribed content
2024,12,Remote Sensing Tailing Pond Image–Detection Method Based on YOLOv8-RVSW,2,1,1,0,Subscribed content
2024,12,Monitoring LULC Changes in Babil Province for Sustainable Development Purposes Within the Period 200,2,0,2,0,Open Access content
2024,12,Image Fusion in Remote Sensing: An Overview and Meta-Analysis,3,2,1,0,Open Access content
2024,11,Morphology-Based Feature Extraction Network for Arbitrary-Oriented SAR Vehicle Detection,2,2,0,0,Subscribed content
2024,11,Spatial-Spectral Middle Cross-Attention Fusion Network for Hyperspectral Image Superresolution,5,4,1,0,Subscribed content
2024,11,Machine Learning and New-Generation Spaceborne Hyperspectral Data Advance Crop Type Mapping,7,0,7,0,Open Access content
2024,11,A Variable-Iterative Fully Convolutional Neural Network for Sparse Unmixing,6,6,0,0,Subscribed content
2024,10,Attention Heat Map-Based Black-Box Local Adversarial Attack for Synthetic Aperture Radar Target Reco,4,3,1,0,Subscribed content
2024,10,Exploring the Potential of the Hyperspectral Remote Sensing Data China OrbitaZhuhai-1in Land Cover C,6,6,0,0,Subscribed content
2024,10,Teacher-Student Prototype Enhancement Network for a Few-Shot Remote Sensing Scene Classification,3,3,0,0,Subscribed content
2024,10,Bank Line Extraction by Integration of Orthoimages and Lidar Digital Elevation Model Using Principal,1,0,1,0,Open Access content
2024,9,Development of an Automatic Feature Point Classification Method for Three-Dimensional Mapping Around,4,0,4,0,Subscribed content
2024,9,Semantic Segmentation of Point Cloud Scene via Multi-Scale Feature Aggregation and Adaptive Fusion,6,6,0,0,Subscribed content
2024,9,A Robust Star Identification Algorithm for Resident Space Object Surveillance,6,5,1,0,Subscribed content
2024,9,Wavelets for Self-Calibration of Aerial Metric Camera Systems,3,1,2,0,Subscribed content
2024,8,Research Progress of Optical Satellite Remote Sensing Monitoring Asphalt Pavement Aging,7,6,1,0,Subscribed content
2024,8,Mapping Winter Wheat Using Ensemble‐Based Positive Unlabeled Learning Approach,5,5,0,0,Subscribed content
2024,8,Building Shadow Detection Based on Improved Quick Shift Algorithm in GF‐2 Images,5,5,0,0,Subscribed content
2024,8,Hyperspectral Reflectance Assessment for Preliminary Identification of Degraded Soil Zones in Indust,4,0,3,1,Subscribed content
2024,8,One-Dimensional-Mixed Convolution Neural Network and Covariance Pooling Model for Mineral Mapping of,4,1,2,1,Open Access content
2024,7,ReLAP-Net: Residual Learning and Attention Based Parallel Network for Hyperspectral and Multispectra,4,0,3,1,Subscribed content
2024,7,Assessing the Utility of Uncrewed Aerial System Photogrammetrically Derived Point Clouds for Land Co,3,2,1,0,Open Access content
2024,7,Enhancing Forest‐Steppe Ecotone Mapping Accuracy through Synthetic ApertureRadar‐Optical Remote Sens,5,5,0,0,Open Access content
2024,7,Dynamic Monitoring of Ecological Quality in Eastern Ukraine Amidst the Russia‐Ukraine Conflict,5,5,0,0,Subscribed content
2024,7,A Surface Water Extraction Method Integrating Spectral and Temporal Characteristics,1,1,0,0,Subscribed content
2024,6,Real-Time Semantic Segmentation of Remote Sensing Images for Land Management,7,6,1,0,Subscribed content
2024,6,Land Use Change in the Yangtze River Economic Belt during 2010 to 2020 and Future Comprehensive Pred,5,5,0,0,Subscribed content
2024,6,An Improved YOLO Network for Insulator and Insulator Defect Detection in UAV Images,8,8,0,0,Subscribed content
2024,6,Monitoring an Ecosystem in Crisis: Measuring Seagrass Meadow Loss Using Deep Learning in Mosquito La,5,0,5,0,Open Access content
2024,6,Real-Time Cross-View Image Matching and Camera Pose Determination for Unmanned Aerial Vehicles,4,4,0,0,Open Access content
2024,5,A Pixel Texture Index Algorithm and Its Application,2,2,0,0,Subscribed content
2024,5,Parcel-Level Crop Classification in Plain Fragmented Regions Based on Multi-Source Remote Sensing Im,4,4,0,0,Subscribed content
2024,5,Evaluation of SMAP and CYGNSS Soil Moistures in Drought Prediction Using Multiple Linear Regression ,5,1,4,0,Subscribed content
2024,5,Debris Flow Susceptibility Evaluation Based on Multi-level Feature Extraction CNN Model: A Case Stud,5,5,0,0,Subscribed content
2024,4,Using Improved YOLOv5 and SegFormer to Extract Tailings Ponds from Multi-Source Data,5,5,0,0,Subscribed content
2024,4,GDP Spatialization in City of Zhengzhou Based on NPP/VIIRS Night-time Light and Socioeconomic Statis,5,2,2,1,Subscribed content
2024,4,"Monitoring Based on InSAR for the Xinmo Village Landslide in Western Sichuan, China",6,6,0,0,Subscribed content
2024,4,Investigation of Underwater Photogrammetry Method with Cost-Effective Action Cameras and Comparative,2,0,1,1,Open Access content
2024,3,Scan Angle Analysis of Airborne Lidar Data for Missing Return Approximation in Urban Areas,2,0,2,0,Subscribed content
2024,3,"Assessment, Specification, and Validation of a Geolocation System's Accuracy and Predicted Accuracy",3,0,3,0,Open Access content
2024,3,A Keyframe Extraction Approach for 3D Videogrammetry Based on Baseline Constraints,3,3,0,0,Subscribed content
2024,3,Extraction of Terraces in Hilly Areas from Remote Sensing Images Using DEM and Improved U-Net,5,5,0,0,Subscribed content
2024,2,"Remote Sensing Application in Water Quality of Lake Burdur, Türkiye",4,0,4,0,Subscribed content
2024,2,The Sight-Aesthetic Value of the Underwater Landscapes of Lakes in the Context of Exploration Touris,4,0,4,0,Open Access content
2024,2,Crop Monitoring System Using MODIS Time-Series Data for Within-Season Prediction of Yield and Produc,1,0,0,1,Open Access content
2024,2,A Few-Shot Semi-Supervised Learning Method for Remote Sensing Image Scene Classification,6,4,2,0,Subscribed content
2024,1,Terrain Complexity and Maximal Poisson-Disk Sampling-Based Digital Elevation Model Simplification,8,4,4,0,Subscribed content
2024,1,I2-FaçadeNet: An Illumination-invariant Façade Recognition Network Leveraging Sparsely Gated Mixture,3,3,0,0,Subscribed content
2024,1,Development of Soil-Suppressed Impervious Surface Area Index for Automatic Urban Mapping,7,1,5,1,Subscribed content
2024,1,Dual-branch Branch Networks Based on Contrastive Learning for Long-Tailed Remote Sensing,6,6,0,0,Subscribed content
2024,1,Comparison of 3D Point Cloud Completion Networks for High Altitude Lidar Scans of Buildings,1,0,1,0,Subscribed content
2023,12,IMU and Bluetooth Data Fusion to Achieve Submeter Position Accuracy in Indoor Positioning,1,0,1,0,Subscribed content
2023,12,Rice Identification Under Complex Surface Conditions with CNN and Integrated Remote Sensing Spectral,6,6,0,0,Subscribed content
2023,12,Combination of Terrestrial Laser Scanning and Unmanned Aerial Vehicle Photogrammetry for Heritage Bu,5,0,2,3,Open Access content
2023,12,Quantifying Impacts of Regional Multiple Factors on Spatiotemporal the Mechanisms for Spatio-tempora,4,4,0,0,Subscribed content
2023,11,Identification of Critical Urban Clusters for Placating Urban Heat Island Effects over Fast-Growing ,3,0,3,0,Subscribed content
2023,11,A Novel Object Detection Method for Solid Waste Incorporating a Weighted Deformable Convolution,8,7,1,0,Subscribed content
2023,11,An Integrated Approach for Wildfire Photography Telemetry using WRF Numerical Forecast Products,2,1,1,0,Subscribed content
2023,11,A Powerful Correspondence Selection Method for Point Cloud Registration Based on Machine Learning,4,3,1,0,Subscribed content
2023,11,Self-Calibration of the Stereo Vision System on the Chang’E-5 Probe Based on Images and Robot Arm Fo,8,8,0,0,Subscribed content
2023,10,Mapping Lotus Wetland Distribution with the Phenology Normalized Lotus Index Using SAR Time-Series I,3,3,0,0,Open Access content
2023,10,The FABDEM Outperforms the Global DEMs in Representing Bare Terrain Heights,3,1,2,0,Open Access content
2023,10,Evaluating Surface Mesh Reconstruction Using Real Data,5,0,4,1,Open Access content
2023,10,Different Urbanization Levels Lead to Divergent Responses of Spring Phenology,5,4,1,0,Open Access content
2023,9,Effect of Latitude As a Significant Element on the Results of Direct UTM Coordinates Transformation ,2,0,0,2,Open Access content
2023,9,CFAR Edge Detection Using Hysteresis Thresholding for Polarimetric SAR Imagery,6,5,1,0,Open Access content
2023,9,Leveraging NAIP Imagery for Accurate Large-Area Land Use/land Cover Mapping: A Case Study in Central,6,0,6,0,Open Access content
2023,9,DORSL-FIN: A Self-supervised Neural Network for Recovering Missing Bathymetry from ICESat-2,2,0,2,0,Open Access content
2023,8,Edge Detection Method for High-Resolution Remote Sensing Imagery by Combining Superpixels with Dual-,5,5,0,0,Open Access content
2023,8,Expansion of Urban Impervious Surfaces in Lahore (1993–2022) Based on Gee and Remote Sensing Data,6,1,3,2,Open Access content
2023,8,Small Object Detection in Remote Sensing Images Based on Window Self-Attention Mechanism,4,4,0,0,Open Access content
2023,8,Application of Improved YOLO V5s Model for Regional Poverty Assessment Using Remote Sensing Image Ta,2,1,1,0,Open Access content
2023,7,A Lightweight Conditional Convolutional Neural Network for Hyperspectral Image Classification,3,3,0,0,Open Access content
2023,7,Multi-Level Perceptual Network for Urban Building Extraction from High-Resolution Remote Sensing Ima,4,4,0,0,Open Access content
2023,7,Classifying Building Roof Damage Using High Resolution Imagery for Disaster Recovery,9,1,7,1,Open Access content
2023,7,Estimation of the Forest Stand Biomass and Greenhouse Gas Emissions Using Lidar Surveys,2,0,2,0,Open Access content
2023,6,3D Scene Modeling Method and Feasibility Analysis of River Water-Land Integration,4,3,1,0,Open Access content
2023,6,High-Resolution Aerosol Optical Depth Retrieval in Urban Areas Based on Sentinel-2,6,5,1,0,Open Access content
2023,6,Change Detection in SAR Images through Clustering Fusion Algorithm and Deep Neural Networks,5,4,1,0,Open Access content
2023,6,Strategies for Forest Height Estimation by High-Precision DEM Combined with Short-Wavelength PolInSA,4,3,1,0,Open Access content
2023,5,Automatic Satellite Images Orthorectification Using K–Means Based Cascaded Meta-Heuristic Algorithm,3,0,3,0,Subscribed content
2023,5,UAS-Based Multi-Temporal Rice Plant Height Change Prediction,6,5,1,0,Subscribed content
2023,5,Spherical Hough Transform for Robust Line Detection Toward a 2D–3D Integrated Mobile Mapping System,8,7,1,0,Subscribed content
2023,5,Blind and Robust Watermarking Algorithm for Remote Sensing Images Resistant to Geometric Attacks,5,4,1,0,Subscribed content
2023,4,GPU-Accelerated PCG Method for the Block Adjustment of Large-Scale High-Resolution Optical Satellite,7,5,1,1,Subscribed content
2023,4,Identification of Drought Events in Major Basins of Africa from GRACE Total Water Storage and Modele,3,1,2,0,Subscribed content
2023,4,Lightweight Parallel Octave Convolutional Neural Network for Hyperspectral Image Classification,6,6,0,0,Subscribed content
2023,4,Model-Driven Precise Degradation Analysis Method of Highway Marking Using Mobile Laser Scanning Poin,7,5,2,0,Subscribed content
2023,2,UAS Edge Computing of Energy Infrastructure Damage Assessment,7,1,5,1,Subscribed content
2023,2,Apricot Tree Detection from UAV-Images Using Mask R-CNN and U-Net,5,0,5,0,Subscribed content
2023,2,Comparative Analysis of Different CNN Models for Building Segmentation from Satellite and UAV Images,3,0,3,0,Subscribed content
2023,2,Unmanned Aerial Vehicle (UAV)–Based Imaging Spectroscopy for Predicting Wheat Leaf Nitrogen,17,0,16,1,Subscribed content
2023,2,Car Detection from Very High-Resolution UAV Images Using Deep Learning Algorithms,4,0,1,3,Subscribed content
2023,1,Exploring the Addition of Airborne Lidar-DEM and Derived TPI for Urban Land Cover and Land Use Class,2,0,2,0,Subscribed content
2023,1,A Machine Learning Method for Building Height Estimation Based on Sentinel-2 Bi-Temporal Images,3,3,0,0,Subscribed content
2023,1,Generation of High-Resolution Orthomosaics from Historical Aerial Photographs Using Structure-from-M,2,0,2,0,Subscribed content
2023,1,The Cellular Automata Approach in Dynamic Modelling of Land Use Change Detection and Future Simulati,6,1,3,2,Subscribed content
2022,12,Automatic Registration Method of Multi-Source Point Clouds Based on Building Facades Matching in Urb,4,3,1,0,Subscribed content
2022,12,The Simulation and Prediction of Land Surface Temperature Based on SCP and CA-ANN Models Using Remot,5,1,2,2,Subscribed content
2022,12,Permanganate Index Variations and Factors in Hongze Lake from Landsat-8 Images Based on Machine Lear,6,5,1,0,Subscribed content
2022,12,Exploring Spatiotemporal Variations and Driving Factors of Urban Comprehensive Carrying Capacity in ,4,3,1,0,Subscribed content
2022,11,Development of Technique for Vehicle Specific Off-Road Trafficability Assessment Using Soil Cone Ind,2,0,1,1,Subscribed content
2022,11,The Use of Indices and Modified U-Net Network in Improving the Classification of Planting Structures,7,6,1,0,Subscribed content
2022,11,Managing Earth Hazards Using the Deep Reinforcement Learning Algorithm for the Industrial Internet o,1,1,0,0,Subscribed content
2022,11,New Generation Hyperspectral Sensors DESIS and PRISMA Provide Improved Agricultural Crop Classificat,2,0,2,0,Subscribed content
2022,11,Foreground-Aware Refinement Network for Building Extraction from Remote Sensing Images,5,4,1,0,Subscribed content
2022,10,Novel Residual Attitude Estimation Approach Using Georeferenced Satellite Imagery,2,0,2,0,Subscribed content
2022,10,Efficient Building Inventory Extraction from Satellite Imagery for Megacities,6,3,3,0,Subscribed content
2022,10,A Semi-Supervised Learning Method for Hyperspectral-Image Open Set Classification,5,5,0,0,Subscribed content
2022,10,The Fractional Vegetation Cover (FVC) and Associated Driving Factors of Modeling in Mining Areas,5,5,0,0,Subscribed content
2022,9,Impact of Spatial Configuration of Urban Green Space and Urban Impervious Surface on Land Surface Te,6,6,0,0,Subscribed content
2022,9,Long-Term Changes of Land Use and Land Cover in the Yangtze River Basin from 1990–2020 Landsat Data,2,2,0,0,Subscribed content
2022,9,A Boundary-Based Ground-Point Filtering Method for Photogrammetric Point-Cloud Data,2,0,2,0,Subscribed content
2022,9,Deep Learning–Based Monitoring Sustainable Decision Support System for Energy Building to Smart Citi,4,2,2,0,Subscribed content
2022,9,Transformer for the Building Segmentation of Urban Remote Sensing,4,4,0,0,Subscribed content
2022,8,"Incorporation of Digital Elevation Model, Normalized Difference Vegetation Index, and Landsat-8 Data",4,0,2,2,Subscribed content
2022,8,Monitoring Environment Transformation Along the BTIC Railway Based on Remote Sensing by Utilizing th,7,7,0,0,Subscribed content
2022,8,A Matching Optimization Algorithm About Low-Altitude Remote Sensing Images Based on Geometrical Cons,3,3,0,0,Subscribed content
2022,8,TPPI: A Novel Network Framework and Model for Efficient Hyperspectral Image Classification,4,4,0,0,Subscribed content
2022,7,Hydrological Topography Data Set (HTD)— the Data Set for High Resolution 2D Urban Flood Modeling,5,1,4,0,Subscribed content
2022,7,Improving Land Cover Classification Over a Large Coastal City Through Stacked Generalization with Fi,2,1,1,0,Subscribed content
2022,7,Evaluation of Urban Vegetation Phenology Using 250 m MODIS Vegetation Indices,3,3,0,0,Subscribed content
2022,7,Monocular Video Frame Optimization Through Feature-Based Parallax Analysis for 3D Pipe Reconstructio,9,8,1,0,Subscribed content
2022,7,Monitoring and Analysis of Urban Sprawl Based on Road Network Data and High-Resolution Remote Sensin,3,2,1,0,Subscribed content
2022,5,Smartphone Digital Photography for Fractional Vegetation Cover Estimation,7,4,3,0,Subscribed content
2022,5,A Low-Cost and Portable Indoor 3D Mapping Approach Using Biaxial Line Laser Scanners and a One-Dimen,4,4,0,0,Subscribed content
2022,5,Alternative Procedure to Improve the Positioning Accuracy of Orthomosaic Images Acquired with Agisof,4,0,2,2,Subscribed content
2022,5,Robust Dynamic Indoor Visible Light Positioning Method Based on CMOS Image Sensor,4,4,0,0,Subscribed content
2022,5,Comparing the Sensitivity of Pixel-Based and Sub-Watershed-Based Analytic Hierarchy Process to Weigh,7,7,0,0,Subscribed content
2022,4,Research on Machine Intelligent Perception of Urban Geographic Location Based on High Resolution Rem,3,3,0,0,Subscribed content
2022,4,Identifying the Driving Factors of Urban Land Surface Temperature,6,5,1,0,Subscribed content
2022,4,Urban Land Cover/Use Mapping and Change Detection Analysis Using Multi-Temporal Landsat OLI with Lid,2,0,2,0,Subscribed content
2022,4,Use of Commercial Satellite Imagery to Monitor Changing Arctic Polygonal Tundra,4,0,3,1,Subscribed content
2022,4,An Evaluation of Pan-Sharpening Methods forSuperView-1Satellite Imagery,5,4,1,0,Subscribed content
2022,4,Floating Solar Park Impacts Urban Land Surface Temperature Distribution Pattern,4,1,3,0,Subscribed content
2022,3,Potential of Open Source Remote Sensing Data for Improved Spatiotemporal Monitoring of Inland Water ,4,0,2,2,Subscribed content
2022,3,Automated 3D Reconstruction of LoD2 and LoD1 Models for All 10 Million Buildings of the Netherlands,5,0,4,1,Subscribed content
2022,3,"Dynamic Linkage Between Urbanization, Electrical Power Consumption, and Suitability Analysis Using R",3,2,0,1,Subscribed content
2022,3,An Optimal GeoAI Workflow for Pan-Arctic Permafrost Feature Detection from High-Resolution Satellite,6,0,5,1,Subscribed content
2022,3,"Assessing the Impact of Land Use Changes on Net Primary Productivity in Wuhan, China",6,6,0,0,Subscribed content
2022,3,Information Extraction from High-Resolution Remote Sensing Images Based on Multi-Scale Segmentation ,5,5,0,0,Subscribed content
2022,2,Spatiotemporal Temperature Fusion Based on a Deep Convolutional Network,4,4,0,0,Subscribed content
2022,2,Three-Dimensional Point Cloud Analysis for Building Seismic Damage Information,8,8,0,0,Subscribed content
